{
  "record_id": "osc-20260221-220833",
  "round_id": "R-20260221-M6-m6-construction-round-sync-11",
  "round_goal": "M6 runtime dry-run scenario A",
  "module_scope": [
    "M6"
  ],
  "owner": "architect",
  "openspec_ref": "m6-construction-round-sync",
  "anc_design_refs": [
    "docs/design/modules/M6-construction-plane.md",
    "docs/design/processes/construction-plane-governance-process.md"
  ],
  "decision_snapshot_ref": "docs/design/modules/evidence/construction-plane/R-20260221-M6-m6-construction-round-sync-11/decision_snapshot.md",
  "sync_status": "in_sync",
  "sync_timestamp": "2026-02-21T22:08:33Z",
  "sync_actor": "architect",
  "trigger_mode": "change_triggered",
  "inspection_profile": {
    "cadence_mode": "adaptive",
    "cadence_hint": "risk-driven",
    "primary_signal": "change_density"
  },
  "risk_level": "medium",
  "conflict_state": {
    "has_conflict": false,
    "resolved": true,
    "resolution_ref": "docs/design/modules/evidence/construction-plane/R-20260221-M6-m6-construction-round-sync-11/decision_snapshot.md"
  },
  "checkpoint_count": 2,
  "commit_count": 2,
  "evidence_bundle": {
    "openspec_linkage_ref": "/var/folders/gq/8h5vhg2n5k977p3zvwcmlf5w0000gn/T/tmp.9MpjhscQ1i/show.json",
    "anc_delta_index_ref": "",
    "sync_check_report_ref": "/var/folders/gq/8h5vhg2n5k977p3zvwcmlf5w0000gn/T/tmp.9MpjhscQ1i/validate.json",
    "status_report_ref": "/var/folders/gq/8h5vhg2n5k977p3zvwcmlf5w0000gn/T/tmp.9MpjhscQ1i/status.json",
    "round_evidence_log_ref": "docs/design/modules/evidence/construction-plane/R-20260221-M6-m6-construction-round-sync-11/round-evidence.jsonl"
  },
  "sync_actions": [
    {
      "action": "openspec_show",
      "result": "ok"
    },
    {
      "action": "openspec_status",
      "result": "ok"
    },
    {
      "action": "openspec_validate_strict",
      "result": "ok"
    }
  ]
}
